{
  "schema_version": "1.0",
  "status": "resolved",
  "locale": "en-US",
  "confidence": 0.88,
  "utterance_normalized": "Add $120.50 groceries to my May budget under Food.",
  "plan": [
    {
      "step_id": "s1",
      "action": "expense.upsert",
      "requires_user_confirm": false,
      "args": {
        "expenses": [
          {
            "budget_id": 12,
            "name": "Groceries",
            "amount": "120.50",
            "is_recurring": false,
            "category_id": 3
          }
        ]
      }
    }
  ]
}
